{
  "schema": 1,
  "version": "1.2.3",
  "revision": "0123456789abcdef0123456789abcdef01234567",
  "images": {
    "daemon": {
      "repository": "ghcr.io/quickchatai/quickreview",
      "index_digest": "sha256:1111111111111111111111111111111111111111111111111111111111111111",
      "platforms": {
        "linux/amd64": "sha256:2222222222222222222222222222222222222222222222222222222222222222",
        "linux/arm64": "sha256:3333333333333333333333333333333333333333333333333333333333333333"
      }
    },
    "memory": {
      "repository": "ghcr.io/quickchatai/quickreview-memory",
      "index_digest": "sha256:4444444444444444444444444444444444444444444444444444444444444444",
      "platforms": {
        "linux/amd64": "sha256:5555555555555555555555555555555555555555555555555555555555555555",
        "linux/arm64": "sha256:6666666666666666666666666666666666666666666666666666666666666666"
      }
    }
  },
  "pins": {
    "pi": "1.4.0",
    "openviking": "0.4.15",
    "llama_cpp_python": "0.3.35",
    "embedder_file": "/opt/openviking/models/bge-small-en-v1.5-f16.gguf",
    "embedder_sha256": "f0b2fef971e8366438bfd2d9aefea1b0115919389448806d290237f638bae999",
    "runspec": 1
  }
}
